1826.005928	1851.926637	I did my undergrad as-- part of my undergraduate studies I did in France and returned to the southern region for six months to work on a new book project that's a bilingual French-English (smattering of Creole), project about slavery and resistance in Louisiana under the French colonial regime. So that's one project, and then there are two other poetry manuscripts.
1852.214645	1873.455226	Also having to do with Louisiana with New Orleans as a topic. But one of them does a lot of experimentation with rhyme, which I've never used, or never used to great effect before. I also write creative nonfiction. So there's a body of essays that I'm working on right now.
1873.455226	1899.015925	And then there is a series of, I guess, for lack of a better word, dispatches about my experiences returning to France after all of those years, looking at French racism, which not only has not improved in the past 30 years, but has intensified and worsened in rather graphic ways.
1899.015925	1918.168448	And so there're always a number of projects going on when, when I'm working well, I'm working on a number of projects. Because just because one thing isn't going well, at one moment, doesn't mean that I can't work on something else. So there's always something, some iron in the fire. 
1919.032472	1945.133186	The way that you're speaking of your experiences in France and New Orleans, it seems to me that you've constructed yourself in feeling as if you're a person with multiple influences and multiple identities in terms of your heritage. And I'm wondering how the label of African American either fits that description or fits your self-- your self-structure or in some ways may even be limiting?
1945.133186	1977.318066	I think it fits perfectly, I think it's-- I think it's about as precise and as exact as we can get. I really think it is because it means a lot of different things at the same time. Of course, historically, we're an African people in the Americas. And there're so many versions and variations of that. And of course, there's a tendency to think of African American as a monolith, which of course, it never is, never was.
1977.318066	1995.462562	And there has been a tendency sometimes on the part of critics looking at my work to say, well, this is not, this is not African American, this is not Black, this is New Orleans. And, and while New Orleans certainly is its own space, its own culture, that space and that culture have always been Black space.
1995.462562	2025.451382	And so it's one of those-- one of the things that I always say is that when we make those kinds of distinctions, that slavery under the French was better or slavery under the Spaniards was better or slavery under the British-- my slave master's better than your slave master never made any sense to me at all. We're talking about different experiences, we're talking about different cultural influences, we're talking about different, different approaches to acquiring and claiming freedom.
2025.451382	2052.956134	And a lot of that stuff is contained in language. And in part, there's a very practical side to that a lot of that is contained in language, because law is written in language. And so once you have the black codes promulgated in the French Caribbean, and later in Louisiana, that sets the tone for how freedom will be denied and claimed and bartered against.
2052.956134	2081.792922	And so certainly African American, I think entirely fits who I am and what I do. But the other thing that I think is that when we look at the Americas, in the broader sense, the things that we single out, as having uniquely to do with the Americas, as opposed to those things having to do with Europe, those things having to do with Africa,
2081.792922	2099.145397	what we're looking at is the influence of people of African descent in the new world. And I don't think we yet realize the hugeness of that reality. I don't think we yet understand what that means.
2099.325402	2124.922102	When ever American culture is transported, what is transported and what is received is something that is Black in its origins. And that's something that I think we need to be very clear about stating and laying claim to and making clear for ourselves, because I think we often are not aware of the extent of our influence in the culture. 
2124.922102	2154.874921	And I think in part, it's because the United States in particular is such a large space geographically, and such a broad space culturally, that it's easy for us not to look beyond the boundaries of the 48 states. But once we step outside of that, and we begin to look at cultures across the world, things begin to make much more sense to us. And our role in the world begins to make much more sense to us.
2154.874921	2179.895605	And how we are depicted and represented, and how we are written about and spoken about, and how we claim the language and languages in which we will write about our own selves, and our own experiences-- those are the things that actually signify America and the Americas in terms of culture, and in terms of cultural transmissions.
2179.895605	2205.420303	And I think that, maybe it's a little bit easier for poets to be aware of that, because I think poets may have a tendency to read across genres and across languages, much more so than other folk, it isn't uncommon for poets to read bilingually, trilingually, or at least to work with bilingual texts. It isn't-- it isn't as unusual perhaps for us to do that.
2206.932344	2230.404986	And to work with translators of our work. It isn't uncommon that translations of prose fiction occur without any participation by the author. It's somewhat rare that such translations occur without the participation of the poet. That's somewhat rare, actually.
2230.404986	2232.961056	Getting a [inaudible] is like being a sort of [inaudible] poetry.
2232.277037	2246.893437	It really is, it really is, and  deciding what remains in the original language, and what gets translated becomes the tricky part. And that's finally how we determine what is or is not a good translation of a poem. 
2248.297475	2248.909492	In terms--
2248.909492	2251.177554	I think, one short question. 
2251.177554	2251.825572	Okay
2251.825572	2253.841627	A Short question with a shorter answer.
2255.101661	2262.01385	Just to conclude, what directions do you see African or American poetry going in the 21st century? 
2262.01385	2288.33057	I think that we're in a place now, where African American poetry in the 21st century is the vanguard. And I think we're maybe not quite aware of that. But African American poetry in the 20th century really is the vanguard, and frankly, always has been the cutting edge for what was happening in poetry in this society.
2288.33057	2312.307225	That we were the modernizers of language in the 1910s and 20s. We brought jazz into written art. We transformed language, we brought in the vernacular, we remade the American language. It is as much ours perhaps more ours than any other group.
2313.171249	2316.303335	Well thank you so much for your time.
2316.591342	2323.179523	Excellent. Thank you! You guys need more time. We need more tape!
2323.179523	2332.791785	Oh oh, don't move yet. We're just gonna get 30 seconds of tape, okay. If you guys could just have any kind of conversation, just don't all talk at once [inaudible].
2332.791785	2335.203851	So, you're taking off tomorrow, right?
2335.203851	2342.260044	Yep, yep. I get back home tomorrow. This has been really really good. [Inaudible]
2342.260044	2343.700084	It has been.
2343.700084	2345.248126	Wait, no wait, Don't look at me!
2345.500133	2346.040148	Sorry.
2346.256154	2346.616163	Sorry!
2346.904171	2348.200207	You live in New Orleans?
2348.200207	2354.644383	I live in New Orleans, yeah, I live in New Orleans. 
2355.184398	2358.100477	When you, you travel very frequently out of the country then?
2358.100477	2365.102669	Well, no, not frequently. I went to school in France when I was a kid, when I was an undergraduate. And this going back with--