986.941	1001.25	<font color='navy'>you see, not even women. Adrienne Rich says, (in one of the anthologies she says), I really got up on stage one day and announced, I am a woman poet, okay, after I read the black poets in America, who</font>	Transcription
1001.251	1010.28	<font color='navy'>were saying, I am a black poet. And that&#39;s why I&#39;m talking about the kind of influence that we had on people, because we identify ourselves, you know, from jump street, you see.</font>	Transcription
1010.851	1022.01	<font color='navy'>I really discovered it when I studied with a woman by the name of Louise Bogan. You go into American literature, and there she is, fine poet and editor for The New Yorker. You know, I mean, the poetry</font>	Transcription
1022.101	1031.28	<font color='navy'>editor for The New Yorker. I walked into a class of 45 people at NYU, my sister. I sat by the door, because no one had ever wanted to even discuss what I was writing,</font>	Transcription
1031.461	1042.17	<font color='navy'>and the first night she says, Does anyone have a poem? That&#39;s like asking a bunch of alcoholics, if they got a bottle someplace. We all went in our pockets, like this, you know, I went in my pocket,</font>	Transcription
1042.171	1053.57	<font color='navy'>and I raised my hand and said find out now, but I raised my hand. She said, Come up front, tell me your name. I did. I read the poem and she... the whole class went [raises hand], responds to it.</font>	Transcription
1053.931	1068.12	<font color='navy'>First time I had response, you know, and she said, &quot;And if you had really read that poem out loud, Sonia, you would have heard the following.&quot; And like, Lo, I stayed. I studied. And then I finally</font>	Transcription
1068.121	1078.47	<font color='navy'>asked her one day in her office, I said, I want to know, do I have talent? She said, &quot;What do you want to know that for Sonia?&quot; I said, well, I said I&#39;d like to know, because, you know, I wanna know</font>	Transcription
1078.471	1082.28	<font color='navy'>if I&#39;m wasting-- I didn&#39;t say that, because I really didn&#39;t think I was wasting my time, right?</font>	Transcription
1082.491	1093.95	<font color='navy'>Because it was in that workshop that I published my first poem. Out of all that class, and I brought in bottles of wine to NYU, you know, at night, you know, and passed it around with little cups. And</font>	Transcription
1093.951	1107.33	<font color='navy'>because she taught us from the jump street, the first day, she said, get a notebook. Put down on one side the Nation, Address, day sent, three poems, no more than three poems, New Yorker, the Mass</font>	Transcription
1107.331	1110.75	<font color='navy'>Review, New England Review, page, page, and start sending your poetry out.</font>	Transcription
1110.841	1121.04	<font color='navy'>I did it, you know. First time I sent it, however, I took it to the mailbox across from where I lived, right? And by the time I got back home, the reply was there. No, thank you, right. But I--</font>	Transcription
1121.04	1122.09	<font color='#008080'><b>Joanne V. Gabbin</b></font>	Speaker
1121.041	1122.09	<font color='#008080'>But it&#39;s so empowering to do that.</font>	Transcription
1122.12	1124.16	<font color='navy'><b>Sonia Sanchez</b></font>	Speaker
1122.121	1124.16	<font color='navy'>It is-- I make my students do it in workshop.</font>	Transcription
1124.25	1124.97	<font color='#008080'><b>Joanne V. Gabbin</b></font>	Speaker
1124.251	1124.97	<font color='#008080'>Yeah. Yeah. I do that as well, yeah.</font>	Transcription
1124.97	1131.69	<font color='navy'><b>Sonia Sanchez</b></font>	Speaker
1124.971	1131.69	<font color='navy'>Oh, yeah. You know, and when I&#39;m editing something, or someone else is editing something I say, write them with this poem, it&#39;s good, tell them you&#39;re in my workshop. And you know,</font>	Transcription
1131.691	1142.25	<font color='navy'>you&#39;ve seen my students get published, along with major poets, you see. That is what you do. You push this thing called poetry, because poetry is one of the most important things that will keep us</font>	Transcription
1142.251	1143.18	<font color='navy'>human on this earth.</font>	Transcription
1143.18	1153.62	<font color='#008080'><b>Joanne V. Gabbin</b></font>	Speaker
1143.181	1153.62	<font color='#008080'>Yeah, we did a children&#39;s workshop yesterday. And the poems that came out of that workshop. Amazing for 12 to 14 year olds.</font>	Transcription
1153.62	1154.52	<font color='navy'><b>Sonia Sanchez</b></font>	Speaker
1153.621	1154.52	<font color='navy'>Oh, no, not at all.</font>	Transcription
1154.52	1155.06	<font color='#008080'><b>Joanne V. Gabbin</b></font>	Speaker
1154.521	1155.06	<font color='#008080'>And that young --</font>	Transcription
1155.09	1157.31	<font color='navy'><b>Sonia Sanchez</b></font>	Speaker
1155.091	1157.31	<font color='navy'>Yeah. The one that read last night, yes.</font>	Transcription
1157.31	1158.54	<font color='#008080'><b>Joanne V. Gabbin</b></font>	Speaker
1157.311	1158.54	<font color='#008080'>The one she read was just wonderful.</font>	Transcription
1158.66	1159.14	<font color='navy'><b>Sonia Sanchez</b></font>	Speaker
1158.661	1159.14	<font color='navy'>Wonderful.</font>	Transcription
1159.65	1172.52	<font color='#008080'><b>Joanne V. Gabbin</b></font>	Speaker
1159.651	1172.52	<font color='#008080'>She talked about all of the different positive aspects of being Black, you know, and darkness, that was really wonderful. You know, I was thinking, you read a poem yesterday, and you</font>	Transcription
1172.521	1175.13	<font color='#008080'>called it a &quot;Poem for Some Women.&quot;</font>	Transcription
1175.16	1175.55	<font color='navy'><b>Sonia Sanchez</b></font>	Speaker
1175.161	1175.55	<font color='navy'>Yeah.</font>	Transcription
1176.06	1189.92	<font color='#008080'><b>Joanne V. Gabbin</b></font>	Speaker
1176.061	1189.92	<font color='#008080'>And, what was the impetus for that poem? It&#39;s a very painful poem. A colleague of mine, walked out of the auditorium and was visibly moved, and told my husband, he just thought that</font>	Transcription
1189.921	1192.98	<font color='#008080'>was one of the most powerful poems he&#39;d ever heard read.</font>	Transcription
1193.61	1203.9	<font color='navy'><b>Sonia Sanchez</b></font>	Speaker
1193.611	1203.9	<font color='navy'>My sister I was watching television one night, you know, at the end of the day. I was getting my tea to go upstairs to, you know, sit-- plop, prop myself up a bit and write or read</font>	Transcription
1203.901	1215.21	<font color='navy'>before I went-- go to sleep. And the news cast came on and this woman said today, today, today, it was reported that a woman in North Philadelphia (which identified her as Black, or Puerto Rican,</font>	Transcription
1215.241	1224.0	<font color='navy'>right, Latina, you know), took her child into the crack house and left her. And then there was this silence, which meant like, Oh, those people do terrible things to their children.</font>	Transcription
1225.411	1236.21	<font color='navy'>And I went upstairs trying to forget it. And I even, you know, read a bit, you know, brushed my teeth, you know, washed my face, pull the covers up, and got up in the middle of the night, and started</font>	Transcription
1236.211	1241.04	<font color='navy'>writing that poem. And that poem is for some women, not all women.</font>	Transcription
1241.191	1251.33	<font color='navy'>That poem is about the question that I wrote in the margin, always-- I always ask my students when they&#39;re writing, what is the first question that comes to your head that motivates you to write this</font>	Transcription
1251.331	1263.39	<font color='navy'>poem? The question was, how have we gone from women on the slave auction blocks, you know, saying master master, please don&#39;t take my child away from me. How have we gone from there to taking that</font>	Transcription
1263.391	1265.67	<font color='navy'>child in the crack house and leaving her for a week?</font>	Transcription
1266.09	1266.54	<font color='#008080'><b>Joanne V. Gabbin</b></font>	Speaker
1266.091	1266.54	<font color='#008080'>Yes.</font>	Transcription
1266.6	1279.77	<font color='navy'><b>Sonia Sanchez</b></font>	Speaker
1266.601	1279.77	<font color='navy'>You know, and it was in that space, that I began to write that poem. You know, in that woman&#39;s voice, you know, who is still human. You understand? When you just do the cold facts,</font>	Transcription
1279.801	1291.02	<font color='navy'>she&#39;s not human. She has no breath. She has no blood. She has nothing except, that&#39;s what she did, you see. But the woman is human, you know. I mean, this woman who lives in her neighborhood, you</font>	Transcription
1291.021	1296.15	<font color='navy'>know, and can get crack, you know. She can find the crack house, but the police can&#39;t find the crack house.</font>	Transcription
1296.241	1303.86	<font color='navy'>But the children can tell you where the crack house is, you know. Everybody on the block can tell you where the crack house is, and it never gets busted, you know what I&#39;m saying? So here she is,</font>	Transcription
1303.891	1311.39	<font color='navy'>marching in, and she sees this man who says, &quot;I don&#39;t want you.&quot; She says, &quot;I&#39;m gonna give you my body.&quot; And he says, &quot;I don&#39;t want you,  but I want a virgin.&quot;</font>	Transcription
1311.571	1326.06	<font color='navy'>What kind of person? What kind of male, you know, looks at 11 a 10, a nine an eight, a 12 a 13-- I&#39;d go up to 16, even, you know-- year old, and you see, you know, you don&#39;t see a human being you</font>	Transcription
1326.061	1334.43	<font color='navy'>know, you don&#39;t see a little girl, right? You know, but you see a virgin, how can you call a 12 year old a virgin? That&#39;s a little girl, maybe one day removed from dolls.</font>	Transcription
1334.521	1345.17	<font color='navy'>So I wanted to have all of that in that piece, you see. And this woman, and she comes back singing &quot;Mama&#39;s little baby loves shortening, shortening, Mama&#39;s a little baby loves shortening bread, put on</font>	Transcription
1345.171	1347.18	<font color='navy'>the jacket, put on the jacket.&quot;</font>	Transcription
1347.271	1356.96	<font color='navy'>Because you see, one of the times when I&#39;m pushed up against the wall with some people, and I have moved to a point where I don&#39;t curse people out, you know, where I don&#39;t attack-- you know, go and</font>	Transcription
1356.961	1365.78	<font color='navy'>say get out of my face, you know, you&#39;re in deep trouble, [inaudible] or whatever. But I&#39;d say you know, can you tell me my brother, what I did to offend you? You know, right. And then sometimes</font>	Transcription
1365.781	1373.01	<font color='navy'>people say &#39;well lalalala&#39;, I said, well, I&#39;ll come back to you. You know, we&#39;ll talk later, and I walk away. But I might walk away humming.</font>	Transcription
1373.191	1383.33	<font color='navy'>Because the humming gets me through that next moment, you know. That humming, makes me understand at some point, there are some people, you know, who really have been taught never to go below this</font>	Transcription
1383.361	1395.36	<font color='navy'>area. They&#39;ve never been taught to go to the heart, or even the bloodstream, or even the mind, or above the mind at all. That their thing is always let us be combative. Let us-- oh, let me stay right</font>	Transcription
1395.361	1399.5	<font color='navy'>here in the gut, and in the other part, in the genitals, you know what I&#39;m saying?</font>	Transcription
1399.561	1409.91	<font color='navy'>Then, but the country keeps you on that level. If it can keep you hungry always, and stuffing your mouth with food, you know. If it can keep you always looking at fighting, people fighting all the</font>	Transcription
1409.911	1419.0	<font color='navy'>time so you get a hard on, you know, like, &quot;Woooo, did they get that--&quot;, whatever, you know, if they can keep the young girls itching all the time to jump in somebody&#39;s bed, because she thinks that&#39;s</font>	Transcription
1419.001	1422.84	<font color='navy'>gonna make her a woman, then you control the populace.</font>	Transcription
1422.961	1433.79	<font color='navy'>But if you move their eyes up to the heart, and if you have a heart, you know, you do not kill. You know what I&#39;m saying? You know, and if you have a mind, you&#39;ll look at it in a different way and</font>	Transcription
1433.791	1444.02	<font color='navy'>begin to say, Aha, but if you have the spirit, you know, spirit mixed with the mind, also, do you know what I&#39;m saying? The spirit and the soul with the mind, then something else happens.</font>	Transcription
1444.261	1453.08	<font color='navy'>And it has been that kind of motion and movement that I&#39;ve tried to do with my poetry. And in that piece, that&#39;s a hard, piece because all of a sudden, I don&#39;t think you remember that poem when I read</font>	Transcription
1453.081	1462.05	<font color='navy'>to you years ago, and I said, and then Joanne I said, I have moved to another level, I don&#39;t write this kind of poem anymore. And then I heard myself say it later on. I said, oops, what are you</font>	Transcription
1462.051	1472.01	<font color='navy'>saying? If it&#39;s happening, you can&#39;t move-- you can&#39;t move to another level. What do you mean you&#39;ve moved to another level? Girl catch yourself, you know, watch yo mouth as the old folks used to say,</font>	Transcription
1472.011	1474.2	<font color='navy'>you know, girl, watch yo mouth, what are you saying?</font>	Transcription
1474.2	1475.97	<font color='#008080'><b>Joanne V. Gabbin</b></font>	Speaker
1474.201	1475.97	<font color='#008080'>Other directions maybe. Are there--</font>	Transcription
1476.21	1477.44	<font color='navy'><b>Sonia Sanchez</b></font>	Speaker
1476.211	1477.44	<font color='navy'>Of course there are other directions!</font>	Transcription
1477.44	1477.56	<font color='#008080'><b>Joanne V. Gabbin</b></font>	Speaker
1477.441	1477.56	<font color='#008080'>Yeah. Yeah.</font>	Transcription
1477.59	1486.77	<font color='navy'><b>Sonia Sanchez</b></font>	Speaker
1477.591	1486.77	<font color='navy'>But the point is what I understand is that I can do this piece-- a very middle class woman said to me, &#39;Ah, Professor Sanchez, I just love your poetry. It is so lyrical. But why would</font>	Transcription
1486.771	1499.43	<font color='navy'>you why something like this?&#39; You know? And that&#39;s like, just recently-- you know, in the airport, when, you know, they grab you because you you&#39;re talking about the country and the war, and Bush and</font>	Transcription
1499.431	1502.85	<font color='navy'>all this stuff, you know, that&#39;s happening. And [Inaudible], you know, they--</font>	Transcription
1502.85	1504.26	<font color='#008080'><b>Joanne V. Gabbin</b></font>	Speaker
1502.851	1504.26	<font color='#008080'>Then you&#39;ve become a security risk.</font>	Transcription
1504.29	1513.65	<font color='navy'><b>Sonia Sanchez</b></font>	Speaker
1504.291	1513.65	<font color='navy'>Yeah. And they said, they said-- and they tag you, you know? Well, Grace Paley, the writer, all of us. I mean, the ACLU called me and said, you know, it&#39;s a list with all you peace</font>	Transcription
1513.651	1524.0	<font color='navy'>people on it, you know what I&#39;m saying? So we want you to know, so I put my name on the thing, where they were going to file to get that list, so it could be published as such. But they grabbed me--</font>	Transcription
1524.001	1526.34	<font color='navy'>but I&#39;m coming out of Syracuse, my sister.</font>	Transcription
1527.361	1539.57	<font color='navy'>And the woman never looks up, the guy didn&#39;t even-- nothing went &#39;ding ding ding ding ding ding&#39;. Nothing with ding, ding, ding, ding at all. But he saw the color code that they have on there. He</font>	Transcription
1539.571	1550.61	<font color='navy'>said, we need you on the side. So I said, Oh, is there a problem? I didn&#39;t hear anything go dingaling, dingaling. You know? And he said simply-- well, yeah, that&#39;s what I was told. I mean, I was told</font>	Transcription
1550.611	1554.36	<font color='navy'>by the brothers outside, but I wanted him to say it too, because his [inaudible] they won&#39;t say it.</font>	Transcription
1554.661	1564.92	<font color='navy'>They just say oh, this is just something that we do with a few, you know, chosen people. But he said it because he saw me looking at him. So the black woman came along, she never looked up at all. She</font>	Transcription
1564.921	1580.55	<font color='navy'>just said, come this way, grabbed my briefcase, and my purse, and she says, &quot;stand back, Stand back.&quot; And so, she opened my purse, and she took my stuff and threw it like it was dirt. And dirty.</font>	Transcription
1580.881	1591.89	<font color='navy'>And I stood there just looked at her. I kept looking at this sister thinking, you know, mmm, mm, it&#39;s hard, you know, you know, it&#39;s hard being human. Then she put my stuff in-- threw it back in, no</font>	Transcription
1591.891	1602.33	<font color='navy'>order. Zipped it. Then she opened my briefcase and the first thing she saw was my picture on a book, and she said &quot;Miss Sanchez.&quot; She looked, she said &quot;Oh&quot;-- looked at me for the first time.</font>	Transcription
1602.541	1614.6	<font color='navy'>And I thought how often we go through life, jobs, all over and we never look people in the eye. Because we&#39;re afraid of what we will see. We will see ourselves when we look people in the face, and we</font>	Transcription
1614.601	1616.1	<font color='navy'>don&#39;t want to see ourselves sometimes.</font>	Transcription
1616.311	1624.89	<font color='navy'>She said &quot;why&quot;-- she whispered, &quot;why are they doing this to you?&quot; I said my sister-- and I whispered back &quot;they&#39;re doing&quot;-- I leaned over, &quot;they&#39;re doing it because I&#39;m talking about the war, against</font>	Transcription
1624.891	1638.27	<font color='navy'>the war, about peace, whatever  et cetera,&quot; she said, why don&#39;t you stop? I said, my dear sister, if I stop, if I stop, if I and others stop, who&#39;s gonna do it? And she lowered her head, and she never</font>	Transcription
1638.271	1642.95	<font color='navy'>finished going all the way through. She just kind of looked through it. And then she opened my bag.</font>	Transcription
1643.76	1644.99	<font color='#008080'><b>Joanne V. Gabbin</b></font>	Speaker
1643.761	1644.99	<font color='#008080'>You know, the typical reaction-- yeah.</font>	Transcription
1644.99	1660.2	<font color='navy'><b>Sonia Sanchez</b></font>	Speaker
1644.991	1660.2	<font color='navy'>--And took the stuff out the bag. And started to put it back in. The right way. And she turned towards me, and she handed me my things, and she said &#39;I&#39;m sorry. I&#39;m so sorry.&#39; And I</font>	Transcription
1660.201	1668.9	<font color='navy'>said, sister, I&#39;m not here for your job. I know you&#39;re sorry. But that&#39;s the state of the country now. And I walked on, you know?</font>	Transcription
1669.2	1675.14	<font color='#008080'><b>Joanne V. Gabbin</b></font>	Speaker
1669.201	1675.14	<font color='#008080'>Yeah, we&#39;ve gotten to the point where it&#39;s very hard to see other people&#39;s pain. It&#39;s very hard,</font>	Transcription
1675.17	1675.41	<font color='navy'><b>Sonia Sanchez</b></font>	Speaker
1675.171	1675.41	<font color='navy'>Well,</font>	Transcription
1675.41	1679.13	<font color='#008080'><b>Joanne V. Gabbin</b></font>	Speaker
1675.411	1679.13	<font color='#008080'>And it&#39;s very hard to confront the evil. That is--</font>	Transcription
1679.22	1690.59	<font color='navy'><b>Sonia Sanchez</b></font>	Speaker
1679.221	1690.59	<font color='navy'>It&#39;s very hard to see your own pain, you see, if you see my pain then you know you also have pain. And most of us you know, camouflage it, disguise it. Drugs, alcohol, lots of men, lots</font>	Transcription
1690.591	1699.14	<font color='navy'>of women, you know, shopping on your lunch hour paying $2,000 for some clothes, you know, that&#39;s another way of doing it. You know what I&#39;m saying? Whatever.</font>	Transcription
1699.291	1710.24	<font color='navy'>You know, going home, turning on the idiot box watching stupid stuff on television that you laugh at-- laughing at yourselves, then going upstairs, screwing, getting up the next morning going to work.</font>	Transcription
1710.451	1717.02	<font color='navy'>Oh, I&#39;m happy. I&#39;m happy, I&#39;m happy. And this is how a country controls people in such a way where they will not speak out.</font>	Transcription
1717.291	1731.0	<font color='navy'>And what we&#39;re trying to do with this poetry-- when I read that poetry, I read that poem to a group of young women who were just returning back to school, and there were about 20 Puerto Rican women,</font>	Transcription
1731.211	1741.44	<font color='navy'>and 20 Black women. And I read that poem out loud. It wasn&#39;t, it wasn&#39;t in the book at that time, right. It hadn&#39;t been published, It was almost published.</font>	Transcription
1741.741	1753.35	<font color='navy'>And, after I&#39;d done the book that they had gotten with all the questions, whatever. I said, the last poem I&#39;ll read, I took a manuscript and I read that poem, and there was this silence. And then a</font>	Transcription
1753.351	1765.05	<font color='navy'>voice from across the room said, &#39;Hey, hey, that&#39;s just like Maria, ain&#39;t it?&#39; I wanted to collapse. I wanted to cry. I wanted to get down on my knees. I wanted to say no, no, no, no, no, no, no. But</font>	Transcription
1765.051	1771.95	<font color='navy'>I knew it wasn&#39;t true. And then a voice says, tell us Professor Sanchez, why is that wrong?</font>	Transcription
1772.821	1784.16	<font color='navy'>And God, I understood the disconnections from teaching. That they should have been taught that by a mother, by an aunt, by a grandmother. I mean, it was-- I mean, they understood it was wrong, but</font>	Transcription
1784.161	1795.29	<font color='navy'>they meant more than that. They meant like, &quot;tell us the cultural information that would keep us from doing that. Tell us what we hold on to so that we would never then take our children to a crack</font>	Transcription
1795.291	1796.7	<font color='navy'>house&quot; is what they wanted.</font>	Transcription
1796.971	1806.84	<font color='navy'>What they needed. You know what I&#39;m saying? That&#39;s what they wanted. That&#39;s what they needed. And so I-- ready to go out of there because I&#39;m going for PEN, the writers organization, I spent my hour</font>	Transcription
1806.841	1808.61	<font color='navy'>in there. I, you know, getting ready to order--</font>	Transcription
1824.571	1836.93	<font color='navy'>--From that experience, so I mean I had to go back and repeat it, again. I had to teach them the culture in such a way-- being women, being human-- that they would take that with them so it went</font>	Transcription
1836.931	1839.3	<font color='navy'>beyond the poem. Do you know what I&#39;m saying?</font>	Transcription
1839.991	1852.65	<font color='navy'>And I got in, and I said to the brother, I looked up the guy&#39;s name. I said, you know, Mr. Santiago, I said, I&#39;m going to 10 West 135th Street, my father&#39;s house. I said, I don&#39;t want to go downtown.</font>	Transcription
1852.681	1862.58	<font color='navy'>You know, I know the Bronx, and I&#39;m from New York. I said, but I have to close my eyes to go to sleep, I said. And I&#39;m tired. I&#39;m really exhausted, but please get me there.</font>	Transcription
1862.791	1872.75	<font color='navy'>And he said, &quot;Don&#39;t I know you? Aint I seen you on television?&quot; I said play it, Sonia. I said yes you have my brother. He said, &quot;Oh, yeah, yeah, I&#39;ll get you there. I&#39;ll get you there sister.&quot; And I</font>	Transcription
1872.751	1886.88	<font color='navy'>was out. I mean, I was out. Because I had to, I mean, to keep from crying, to keep from collapsing, and to say it over and over again, &#39;till it was ingrained, not only here, but here. And here. And</font>	Transcription
1886.881	1891.47	<font color='navy'>here. And here. And here. You know, then I felt comfortable leaving.</font>	Transcription
1891.891	1901.88	<font color='navy'>And then I heard this voice say, &quot;Ms. Sanchez, wake up, wake up.&quot; And I was in front of my father&#39;s you know, and I said, &quot;can I--&quot;, And he said, &quot;don&#39;t pay me nothing. No, no, no, don&#39;t pay me</font>	Transcription
1901.881	1911.78	<font color='navy'>nothing. Don&#39;t pay me nothing. It&#39;s my privilege,&quot; whatever. And I got out and went up to my father&#39;s house who was really not well, and you know, I really didn&#39;t-- you know, it&#39;s one of those days so</font>	Transcription
1911.781	1918.02	<font color='navy'>I said, Listen, Dad, do you know what just happened to me? Then I had to go into another arena, you know, with him.</font>	Transcription
1918.531	1936.89	<font color='navy'>But my sister, that&#39;s how I see this thing called poetry. Most of the poets I know, from Adrienne Rich, Audre Lorde, June Jordan, Gwendolyn Brooks, Margret Walker. I said Alice Walker, Amiri Baraka,</font>	Transcription
