2684.551	2698.02	<font color='indigo'>Yeah, but also, I mean, I think that there is that but I think there&#39;s also a lot of blackness policing going on by peers and by an older generation, in some cases, that is very</font>	Transcription
2698.111	2713.83	<font color='indigo'>frustrating sometimes, for young black people trying to find their voice, that there are a lot of versions of blackness that are very prescriptive, you know? Well, you know, the real thing is, you</font>	Transcription
2713.831	2725.65	<font color='indigo'>know, whatever gangster rap is the real thing, or, you know, the real thing is church, or the real thing is, I mean, we could name any number of different versions of the real thing that I think</font>	Transcription
2726.341	2737.53	<font color='indigo'>sometimes have made it, made it difficult for, for young black people who are saying, but the voices inside my head are telling me a lot of different very complicated things. And I will just return to</font>	Transcription
2737.531	2749.65	<font color='indigo'>this, I think this Ellison quote is really important and, and, and helpful, We create the race by creating ourselves and then to our great astonishment, we will have created something far more</font>	Transcription
2749.651	2762.07	<font color='indigo'>important, we will have created a culture. So, I think in a way, one answer to your question, which may sound like a cop out, but I don&#39;t think that it is, is that you know, it is for each black</font>	Transcription
2762.071	2775.66	<font color='indigo'>person to listen to those voices and answer for themselves, what is to be salvaged? What is to be refigured? What is useful? And what is their particular vision of their own black selves? And then and</font>	Transcription
2775.661	2790.81	<font color='indigo'>then how does that fit into a larger context? Because I do think that in the post-integration era that we&#39;re in now, that questions of, you know, who are my relatives who are my ancestors, I do think</font>	Transcription
2790.811	2805.78	<font color='indigo'>that they&#39;re, they&#39;re more complicated, more complicated to negotiate. So I think that it&#39;s some not necessarily saying that each person needs to be solipsistic, to say that each person needs to</font>	Transcription
2805.991	2816.43	<font color='indigo'>answer that question for themselves. And then perhaps even, we could say, it&#39;s not necessarily the writers role, but it&#39;s, you know, sort of critics and commentators role to be additive and to say,</font>	Transcription
2816.431	2829.84	<font color='indigo'>Well, you know, I see this poet and this poet in this, let&#39;s, let&#39;s step back and see what&#39;s happening in in black expressive culture at this moment, and not so much for the individual writer to have</font>	Transcription
2829.841	2836.71	<font color='indigo'>to place themselves in history of the present tense. That&#39;s what I&#39;d say.</font>	Transcription
2837.31	2848.44	<font color='darkcyan'><b>Eleanor W. Traylor</b></font>	Speaker
2837.311	2848.44	<font color='darkcyan'>That&#39;s been the tradition. Writers have always done it. The whole miracle of black poetry is just that kind of speaking out. There are always prescriptions of one kind or another.</font>	Transcription
2850.031	2863.38	<font color='darkcyan'>And the greater voice usually violates them. And it should, and that&#39;s what it means and it will, and nothing should be jettisoned or nothing sacred or nothing can all of it will be used somehow or</font>	Transcription
2863.381	2884.41	<font color='darkcyan'>another. They are no should be-s. By the way. There are surprises, miraculous, wonderful surprises. And those surprises give us the ongoing flowing literature that we have, I think all ages have</font>	Transcription
2884.411	2903.19	<font color='darkcyan'>produced their work anxiety, neuroses, anxiety of influence. But and this one, I don&#39;t think necessarily more than another time, except that the issues are probably more brave.</font>	Transcription
2904.6	2907.63	<font color='indigo'><b>Elizabeth Alexander</b></font>	Speaker
2904.601	2907.63	<font color='indigo'>You dont think integration has changed things radically?</font>	Transcription
2907.84	2924.61	<font color='darkcyan'><b>Eleanor W. Traylor</b></font>	Speaker
2907.841	2924.61	<font color='darkcyan'>Well, I think integration has changed. Yeah, but I yes. But as I said before, I think that much is the difference between whether those are posed as political questions, or</font>	Transcription
2924.611	2944.86	<font color='darkcyan'>aesthetic ones. You know, what I mean? It&#39;s not that the two don&#39;t conjoin, of course, but I think that there are answers and acute ones, you know, when we turn the lens on one, or the other at a time</font>	Transcription
2945.161	2969.25	<font color='darkcyan'>and then bring them together? Yes, it has posed but in the whole business of, of saying to people stop, you&#39;re saying nasty things about women is a whole new league, right? People used to do that with</font>	Transcription
2969.251	2986.29	<font color='darkcyan'>impunity, did they not? Yes or no other[?] thing. The whole business as you pointed out, people addressing in public I mean, we take these things for granted they are not for granted things to take.</font>	Transcription
2987.311	3006.84	<font color='darkcyan'>Their sexual preferences is a is an age, you know phenomenon. And there has been no muting of voices about any of this. You&#39;ve had a profusion in the common world, well name a furious flower. No one</font>	Transcription
3006.841	3019.98	<font color='darkcyan'>is stopping, no one is obeying. People are crafting language that 50 years down, people will be on a panel like this reading their poems talking about And see And see And see this is archetypal. So.</font>	Transcription
3020.701	3042.0	<font color='darkcyan'>It&#39;s continuing, don&#39;t you think? I mean? So what folks are feeling a little crampy toed? That&#39;s fine, then they have to make shoes, right? That&#39;s what it&#39;s all about the creative effort, making sure</font>	Transcription
3043.711	3044.7	<font color='darkcyan'>we go to the next question.</font>	Transcription
3047.22	3059.73	<font color='chartreuse'><b>Monifa A. Love</b></font>	Speaker
3047.221	3059.73	<font color='chartreuse'>Good morning, my name is Monifa Love. And we&#39;re going to be a little long in the build up to the question. Sun Ra, in an interview, said that he was playing a music that he felt was</font>	Transcription
3059.851	3073.65	<font color='chartreuse'>part of the music that kept the world together. And that he definitely felt without certain music being played, the world would fly apart. Going back to the question before about spiritual issues,</font>	Transcription
3074.071	3089.01	<font color='chartreuse'>poets amongst themselves talk about writing poems that will turn people inside out. But we don&#39;t talk about that either as a political issue or an aesthetic issue. Do you think that people, is there a</font>	Transcription
3089.011	3103.8	<font color='chartreuse'>place where we can talk about what we think we&#39;re doing on the page beyond personal expression beyond protest? But somehow, In the beginning, there was the word kind of idea on the on the page? Do you</font>	Transcription
3103.801	3105.33	<font color='chartreuse'>understand what I&#39;m trying to get at?</font>	Transcription
3109.74	3121.89	<font color='sienna'><b>Sherley Anne Williams</b></font>	Speaker
3109.741	3121.89	<font color='sienna'>Understand what you are trying to get at? But I&#39;m not sure of you know, if you&#39;re using the word talk, metaphorically, meaning Is there, you know, do we write about these things</font>	Transcription
3121.891	3136.17	<font color='sienna'>also? Or, or what? But it also seems to me that what you are talking about, for me, at least is a very, you know, private kind of question. And that while I&#39;m willing to, you know, to really talk</font>	Transcription
3136.171	3151.41	<font color='sienna'>about technique, and how you achieve certain kinds of effects, I&#39;m less willing to talk about what for me is like the beginning or, you know, on and on, in those kinds of terms, because, as I say, I</font>	Transcription
3151.411	3163.86	<font color='sienna'>mean, it is very personal, it is very private. And in some sense, I guess, I kind of have the feeling that when you begin to probe too deeply into certain sources of your own art, at least for me, I,</font>	Transcription
3164.371	3178.5	<font color='sienna'>I just really want to back away, I&#39;m not wanting to expose that in the way that something has to be exposed, or at least the attempt made when you begin to put certain things into words.</font>	Transcription
3180.13	3193.24	<font color='indigo'><b>Elizabeth Alexander</b></font>	Speaker
3180.131	3193.24	<font color='indigo'>And I would just give two off-the-top-of-my-head recommendations, to turn back to Robert Hayden&#39;s poetry. And to go and think about, I mean, the way in which his work is very much</font>	Transcription
3193.241	3206.29	<font color='indigo'>informed by his being Bahai but also I think, is explicitly striving to address some of the spiritual questions that you seem to be interested in. And also, there&#39;s a new book by Cyrus Cassells,</font>	Transcription
3206.291	3216.82	<font color='indigo'>called Soul Make a Path through Shouting that just came out from Copper Canyon Press that I think you might find addresses some of those spiritual concerns.</font>	Transcription
3217.8	3219.24	<font color='#008080'><b>Alvin Aubert</b></font>	Speaker
3217.801	3219.24	<font color='#008080'>One question here, please.</font>	Transcription
3220.26	3230.19	<font color='crimson'><b>Mylea Thompson</b></font>	Speaker
3220.261	3230.19	<font color='crimson'>Yes, my name is Mylea Thompson, and I&#39;m from Norfolk State University. My major is English, and I&#39;m an undergraduate. The question I have for you this morning, is can you please tell</font>	Transcription
3230.191	3242.22	<font color='crimson'>me why a poem should have more than one meaning. I, as a poet, sometimes when I write, I only have one thing to say, and that&#39;s exactly what I mean, when I put it down. Why do you feel that it is</font>	Transcription
3243.031	3246.66	<font color='crimson'>wonderful for a poem to have so many different meanings?</font>	Transcription
3247.26	3255.81	<font color='sienna'><b>Sherley Anne Williams</b></font>	Speaker
3247.261	3255.81	<font color='sienna'>I don&#39;t think I actually said so many different meanings. I said something about, you know, bring evoking different nuances. And, you know, that kind of thing that it doesn&#39;t</font>	Transcription
3255.991	3268.02	<font color='sienna'>mean exactly the same thing every single time. But even though you have said exactly what you want to say in your poem, doesn&#39;t mean that I&#39;m going to get exactly what you have said out of it. I may,</font>	Transcription
3268.021	3279.93	<font color='sienna'>in fact find not something we hope you know, an entirely different because I think if it&#39;s an entirely different from what you intended, then you the writer has failed, but that I may find something</font>	Transcription
3279.931	3294.18	<font color='sienna'>more than what you intended. And, you know, using what you you know, the basic word, I may in fact come to you know, something that you know, you may have wanted me to get to A and I get to A and go</font>	Transcription
3294.181	3309.78	<font color='sienna'>on to B because it&#39;s there impossible given the associations of images of words of sounds and those kinds of things. If you don&#39;t get something different, not so much different, but something new, a</font>	Transcription
3309.781	3324.96	<font color='sienna'>kind of refreshed feeling out of a work of art, whether it is a poem or a picture or a whatever, then as I say, I don&#39;t believe that it really it&#39;s not doing its job, that you want to find something</font>	Transcription
3325.261	3337.41	<font color='sienna'>else there. When I go back and reread things, as you know, we all periodically do when I look at a poem, look at a picture again. I&#39;m looking for that, that thing that I missed the first time, because</font>	Transcription
3337.411	3342.63	<font color='sienna'>it&#39;s not really possible to take the whole of it in at one glance.</font>	Transcription
3343.53	3353.01	<font color='indigo'><b>Elizabeth Alexander</b></font>	Speaker
3343.531	3353.01	<font color='indigo'>And also, I mean, I agree very much with what you&#39;re saying and feel quite militant about it actually, that, you know, poems good poems are living documents. And I say that as</font>	Transcription
3353.011	3361.98	<font color='indigo'>someone who writes them, and someone who reads them, because, you know, while I mean, sloppy reading is one thing, and let&#39;s just put that to the side. I mean, I think if you read something, and you</font>	Transcription
3361.981	3371.67	<font color='indigo'>don&#39;t, if someone&#39;s not paying attention to what you have put forward on the page, and they want to make it completely their own thing, well, then go write another poem, that that&#39;s something else.</font>	Transcription
3371.881	3388.41	<font color='indigo'>But it seems to me that once I write something, it goes out into the world. And then there&#39;s someone like me on the other end, who says, you know, who is to know precisely precisely what Robert Hayden</font>	Transcription
3388.441	3403.92	<font color='indigo'>or anyone whose poetry has been important to me what exactly they meant. They&#39;ve given us something. And then I think it&#39;s our job and our great fortune, to be able to regard it, pay close attention</font>	Transcription
3403.921	3416.43	<font color='indigo'>to it and then make the associations that that we will. I think that that&#39;s, that&#39;s what makes art great and that&#39;s what makes it more than just a telephone call.</font>	Transcription
3417.63	3423.54	<font color='#008080'><b>Alvin Aubert</b></font>	Speaker
3417.631	3423.54	<font color='#008080'>Thank you for coming, and let&#39;s show our appreciation again for the members of the panel.</font>	Transcription
