1331.431	1347.33	<font color='darkcyan'>don&#39;t know when. And you we don&#39;t know, when people began to call measured word and measured sound poetry. But that&#39;s what it&#39;s always been. It seems, you know, when you read it through time time,</font>	Transcription
1347.661	1368.9	<font color='darkcyan'>it&#39;s commitment on the page. And all those things that accompany that, that my graduate students instruct me is very interesting. But every poet has said I want to be read heard, performed, not</font>	Transcription
1368.901	1396.62	<font color='darkcyan'>studied or what ever. But it is the whole event, to me, is a performance event. And the poet is most successful when his voice is performed, by himself by others, in a concert hall in a classroom, the</font>	Transcription
1396.621	1422.21	<font color='darkcyan'>performance of that magical orchestration, you know of sound with a measured measured word, word is what it&#39;s all about. For me. Oh, no. Oh, okay. I just said you, did you most of you. I just said it</font>	Transcription
1422.211	1423.77	<font color='darkcyan'>was what it&#39;s all about. I think</font>	Transcription
1432.86	1442.16	<font color='NONE'><b>Unknown Speaker</b></font>	Speaker
1432.861	1442.16	<font color='NONE'>My questions are for Mr. Aubert. Earlier, you made a distinction between folk and popular. But you didn&#39;t elaborate. And I wasn&#39;t totally familiar with the distinction you were</font>	Transcription
1442.161	1452.96	<font color='NONE'>making. I was wondering if you could speak on that. And also was wondering if the use of black cultural products as commodities in our in our capitalist economy has anything to do with the transition</font>	Transcription
1452.961	1460.28	<font color='NONE'>from folk to popular, and I don&#39;t know how familiar you are with rap, but if you could comment on whether or not you feel rap has made that that switch.</font>	Transcription
1461.78	1478.46	<font color='#008080'><b>Alvin Aubert</b></font>	Speaker
1461.781	1478.46	<font color='#008080'>Um, I&#39;m not sure that I&#39;m prepared. The reason why I brought up the topic of the distinction between the folk and pop is because I wasn&#39;t prepared to talk about it. And I wanted to just</font>	Transcription
1478.461	1490.97	<font color='#008080'>simply want to raise it as a possibility for young people who want to look into this and such as yourself, you see, but it does seem to me that when you go from the folk to the popular, you do move</font>	Transcription
1490.971	1501.17	<font color='#008080'>into commodification more. You see, even though I mentioned the Golden Gate Quartet, how many of you know the Golden Gate Quartet, you know, and I listened to the Golden Gate Quartet, those old</font>	Transcription
1501.171	1516.68	<font color='#008080'>recordings and I hear rap. You know, we&#39;re rapping way back in the 40s and 50s. And what have you, their records sold, but they weren&#39;t as commodified as people are today. So I still sort of think of</font>	Transcription
1516.681	1527.18	<font color='#008080'>them as in the, in the, in the realm of the folk, although I don&#39;t want to get into dichotomizations either. Because I think things should go together rather than be, rather than be separated. So I</font>	Transcription
1527.181	1534.14	<font color='#008080'>would like to find instead to discover that there&#39;s a conflation, perhaps of the, of the folk and the popular.</font>	Transcription
1534.32	1535.55	<font color='NONE'><b>Unknown Speaker</b></font>	Speaker
1534.321	1535.55	<font color='NONE'>So it&#39;s like a spectrum?</font>	Transcription
1536.18	1546.14	<font color='#008080'><b>Alvin Aubert</b></font>	Speaker
1536.181	1546.14	<font color='#008080'>And but inevitably, we have to deal with spectra with spectrum. Yes, I think that there may be a spectrum. But and then a spectrum, of course, doesn&#39;t dichotomize it says you&#39;re either</font>	Transcription
1546.321	1562.31	<font color='#008080'>closer to the center close to that end. And somewhere along somewhere along the spectrum. Yeah. But I just posit that as an area of investigation for for some young scholars who may be present at that</font>	Transcription
1562.371	1579.2	<font color='#008080'>moment, especially, yeah. But I think that things have to be integrated in art. I&#39;m not fully given over to the idea that poetry is just for performance, I will never be given a because there are</font>	Transcription
1579.201	1593.87	<font color='#008080'>people who want to sit by the fire side and read a book. So the portrait has to be to me to be written in such a way as to be able to perform itself on the page, as well as orally in an auditorium. I</font>	Transcription
1593.871	1606.26	<font color='#008080'>think it should do both. And I think Don, Don Lee at the time now Haki Madhubuti was moving in that direction. When he put out his book, I will We will Walk the Way of the New World. And I saw some</font>	Transcription
1606.261	1620.03	<font color='#008080'>great potential in that book for development along that line. But then Haki stopped writing poetry. He started writing aphorisms, you see, but I can understand that too, because he&#39;s an activist. And</font>	Transcription
1620.031	1634.67	<font color='#008080'>his vision of accomplishment was was a tremendous one and is a tremendous one which he continues continues to pursue in Chicago with his publishing house. And his his school, you know, that he and his</font>	Transcription
1634.671	1649.79	<font color='#008080'>wife have, and also he teaches at a university now so no, I think he I don&#39;t know why he gave up writing. the way he started writing in We Walk with a New World. Maybe he did continue maybe I just</font>	Transcription
1649.791	1654.14	<font color='#008080'>haven&#39;t seen it. Thanks.</font>	Transcription
1656.54	1664.07	<font color='teal'><b>Shahara Brookins Drew</b></font>	Speaker
1656.541	1664.07	<font color='teal'>My name is Shahar Brookins. I&#39;m a graduate student at Brown University. Before I ask my question, I just like to say to the gentleman who just asked that last question, I&#39;m</font>	Transcription
1664.071	1674.54	<font color='teal'>working on the commodification of blackness and pop culture and literature. So I&#39;d love to talk to you after. But my question concerns this whole performance aspect of poetry that we were talking</font>	Transcription
1674.541	1686.36	<font color='teal'>about, and how it&#39;s meant to be read, in the oral tradition. I&#39;m wondering, I&#39;ve heard a lot of different people read a lot of different poems: the author, him or herself, and then other poets or</font>	Transcription
1686.361	1696.59	<font color='teal'>other people. And I&#39;m wondering if there&#39;s a danger at all, in doing that, because every time the poem is, is read by different people, it sounds different all of the time. And I get different things</font>	Transcription
1696.591	1707.51	<font color='teal'>out of the poem. And I&#39;m wondering if there&#39;s ever a danger in performance, when it&#39;s not done by the author themselves of it being misconstrued, or the aesthetics and what the author or poet was</font>	Transcription
1707.511	1709.1	<font color='teal'>intending actually changing.</font>	Transcription
1711.11	1725.18	<font color='sienna'><b>Sherley Anne Williams</b></font>	Speaker
1711.111	1725.18	<font color='sienna'>That danger, I think, there&#39;s that danger, even in, in reading a poem, but the fact that you get, you know, the danger of it being misconstrued, or people misunderstanding, but</font>	Transcription
1726.111	1739.34	<font color='sienna'>that danger is there, whether the poem is actually read, or whether it is being, you know, performed by somebody else other than the author. And to me, in a way, it is, in fact, a kind of, let me say</font>	Transcription
1739.341	1752.81	<font color='sienna'>two things: In a way, it&#39;s like the mark of a great work of art that, in fact, you get multiple and variable kinds of meanings out of it, it shouldn&#39;t mean that exactly the same thing every single</font>	Transcription
1752.991	1769.52	<font color='sienna'>time. That&#39;s not art that&#39;s repetition. And, and that&#39;s rote, and at the same time, I do think that it&#39;s a good thing that somebody else performs the poem, and does it in a different way and is able</font>	Transcription
1769.521	1778.88	<font color='sienna'>to see and to bring forth to evoke different kinds of nuances. I think that that&#39;s all a part of what the artistic spirit experience itself is supposed to be.</font>	Transcription
1780.56	1789.05	<font color='#008080'><b>Alvin Aubert</b></font>	Speaker
1780.561	1789.05	<font color='#008080'>And I think the poem should precede performance. Rather than start with a performance and then come up with a poem. I think you should start with a poem and then perform it if you&#39;re</font>	Transcription
1789.051	1792.23	<font color='#008080'>going to perform. So you&#39;ll have something to perform.</font>	Transcription
1799.61	1810.29	<font color='chocolate'><b>Adam David Miller</b></font>	Speaker
1799.611	1810.29	<font color='chocolate'>Thank the panel for its work. tremendous, tremendous, Im really impressed, everybody. I&#39;m Adam David Miller, one of the visiting poets. I came from the West Coast, Ms Williams from</font>	Transcription
1810.291	1826.73	<font color='chocolate'>the West Coast. You notice nobody&#39;s having the West Coast. They didn&#39;t invite nobody on the West Coast. Anyhow, they, I&#39;d like to ask the panel, if they&#39;d speak to spirituals and the Gospels in</font>	Transcription
1826.731	1837.08	<font color='chocolate'>relation to this vernacular, work it spirituals the spirituals and the Gospels. Could you do that? Could you bring that into the discussion?</font>	Transcription
1837.41	1838.85	<font color='#008080'><b>Alvin Aubert</b></font>	Speaker
1837.411	1838.85	<font color='#008080'>And in how what</font>	Transcription
1838.21	1847.33	<font color='chocolate'><b>Adam David Miller</b></font>	Speaker
1838.211	1847.33	<font color='chocolate'>-vernacular in the poetry as a source for the poetry and so on, the whole matrix, the mix, where this stuff comes from, is that</font>	Transcription
1847.97	1858.92	<font color='sienna'><b>Sherley Anne Williams</b></font>	Speaker
1847.971	1858.92	<font color='sienna'>That&#39;s one of the reasons I say, I&#39;m very glad that these are going to be published because I think that that&#39;s, in fact, exactly what Eleanor Traylor&#39;s paper was talking about</font>	Transcription
1859.281	1871.88	<font color='sienna'>the fact that when we so very often, when we talk about the vernacular, or we talk about popular culture, we talk about folk or whatever the oral culture, we tend to leave out the spiritual aspect of</font>	Transcription
1871.881	1885.56	<font color='sienna'>it, when in fact, it is the spiritual that is, you know, kind of like the root of all of that, at least in terms of historical discovery. So that it&#39;s there. Literary people or academic people, for</font>	Transcription
1885.561	1903.56	<font color='sienna'>whatever reason, tend to ignore it. And in some ways, that&#39;s a bad thing, because it gives a kind of skewed aspect to the culture. We, as far as anybody outside of the culture knows, we are a totally,</font>	Transcription
1903.891	1916.16	<font color='sienna'>almost a completely secular people. And that whatever, you know, our spiritual life is, it doesn&#39;t have any bearing on the quote unquote, culture we create, which is how you can get into calling some</font>	Transcription
1916.161	1928.85	<font color='sienna'>of these calling a lot of things that that are questionable, or at least controversial, as far as culture is concerned, calling a culture, right, but it&#39;s there for the people inside of the culture</font>	Transcription
1928.851	1941.18	<font color='sienna'>itself. I mean, it becomes almost like all something secret and hidden. And because it is secret, and hidden, it&#39;s not as open to exploitation, and misuse in the way that other aspects of the culture</font>	Transcription
1941.181	1956.6	<font color='sienna'>have become a kind of like the common property of everybody, of everybody in America. Some of that may be breaking down now, because more people inside of the culture inside of the field, are saying</font>	Transcription
1956.601	1970.76	<font color='sienna'>to themselves, or asking themselves, why is it that I am, you know, calling the the real, the authentic, only what happens out in the street, when, in fact, black people live in exist and work and</font>	Transcription
1970.761	1981.11	<font color='sienna'>create all over and that we have always created within the church. And what we&#39;ve done is, you know, really helped to change what the definition of church and what the definition of religion, what the</font>	Transcription
1981.111	1992.36	<font color='sienna'>definition of spiritual is, in the same the way that what we have done has helped to change what is the definition of poetry? What is the definition of high and low culture and everything else about</font>	Transcription
1992.391	2005.41	<font color='sienna'>American life? So I think that it&#39;s it&#39;s there. And certainly it&#39;s here on this panel it just hasnt gotten the kind of scholarly attention that other aspects of the culture have gotten.</font>	Transcription
2005.0	2020.81	<font color='indigo'><b>Elizabeth Alexander</b></font>	Speaker
2005.001	2020.81	<font color='indigo'>I would disagree with that a little bit. But I think it&#39;s maybe just a matter of perspective. But um, I don&#39;t know, my my sense of things is that actually, that the sacred is</font>	Transcription
2020.901	2034.13	<font color='indigo'>over-emphasized in the way that black people are portrayed in the media at large. Our leadership, I think, is presented as being almost exclusively sacred, or from the church in, in, in one way or</font>	Transcription
2034.131	2046.79	<font color='indigo'>another. It seems like that sometimes, I mean, I think of you know, Bill Clinton just loves when black church people sing, you know, you need when you when you think about what, what literally does,</font>	Transcription
2046.791	2061.61	<font color='indigo'>what are the are the points and I&#39;m not talking about the depth of that access, but the points of public access, regardless of what the representation is, it seems to me that in some ways, the sacred</font>	Transcription
2061.611	2075.68	<font color='indigo'>is disproportionately represented. That&#39;s just my, the way that I see it. But I think in terms of spirituals in particular, I know that when I teach like a survey course in African American poetry, I</font>	Transcription
2075.681	2092.9	<font color='indigo'>always talk about not only spirituals but also folktales, folk sayings, a lot of the aphorisms that Sterling Brown lists for example, in in the Negro Caravan is a way of thinking about what was there</font>	Transcription
2092.901	2104.48	<font color='indigo'>in our poetic tradition when there wasn&#39;t as much of it written down as there is now for all of the historical and political and cultural  reasons that we can, that we can talk about. So I see that</font>	Transcription
2104.481	2109.61	<font color='indigo'>linkage as just being as being really important. But I&#39;m interested in this question of...</font>	Transcription
2111.11	2121.34	<font color='sienna'><b>Sherley Anne Williams</b></font>	Speaker
2111.111	2121.34	<font color='sienna'>I think that, you know, the I think our leadership has been, at least, you know, kind of, and when I say public now, I mean public in the sense that it is portrayed in terms of</font>	Transcription
2121.701	2134.93	<font color='sienna'>the white press, that that has been disproportionately, you know, from, you know, the religious community. But in terms of, well, it&#39;s almost like we don&#39;t have any other kind of life, except you are</font>	Transcription
2134.931	2146.09	<font color='sienna'>either in the church or elsewhere in the whorehouse. And those are the two extremes that are that are portrayed. And when we talk about what I, when I speak about what we do with the university, what</font>	Transcription
2146.091	2158.3	<font color='sienna'>we have always emphasized is a circular, secular aspect of life. And that I think that has to do with the whole humanist tradition out of which, you know, most of us work. That people, even when you</font>	Transcription
2158.301	2171.71	<font color='sienna'>are religious, and you go to church, and this is really a part of your life, you very most often do not bring that, obviously, or directly or overtly to bear in your, in your work. I mean, you always</font>	Transcription
2171.711	2182.12	<font color='sienna'>get to kind of surprise when at least I do when singers get up in there accepting the award. And they say, Well, first of all, let me give glory to God. Can you imagine some literary critic standing</font>	Transcription
2182.121	2190.04	<font color='sienna'>up and saying, Well, first of all, let me give glory to God. Now, I&#39;m going to tell you my title. I mean, you just don&#39;t do that. In the academic world.</font>	Transcription
2190.82	2204.35	<font color='#008080'><b>Alvin Aubert</b></font>	Speaker
2190.821	2204.35	<font color='#008080'>You don&#39;t do it anywhere. Really, because I heard someone say, of a gospel group on television, once this group not only sings the gospel, this group lives the gospel. And that, to me is</font>	Transcription
2204.351	2221.18	<font color='#008080'>an important point. Because when I use a great deal of a lot of religious and spiritual allusions in my poetry, but I&#39;m not a church-going person, and I doubt that I ever will be. You know, but I&#39;m a</font>	Transcription
2221.181	2235.13	<font color='#008080'>very spiritual person. But and I recognize the role that that religion and the church has played in the lives of black people. I recognize it and I applaud it, and I celebrate it in my poetry. You</font>	Transcription
2235.131	2252.05	<font color='#008080'>see, and if a person can be a true believer, that is an accomplishment, but one that I&#39;m not sure that I&#39;m capable of, ever was and ever will be. That and I don&#39;t I can&#39;t imagine anybody writing</font>	Transcription
2253.371	2271.61	<font color='#008080'>religious poetry today, that doesn&#39;t sound like a like, like, like, jingoistic? or what have you. I&#39;d like to see somebody do the kind of religious poetry that John Donne and George Herbert and Gerard</font>	Transcription
2271.611	2279.02	<font color='#008080'>Manley Hopkins did. But I can see that but i don&#39;t think i think the time has passed for that. I don&#39;t think it can be done today.</font>	Transcription
2279.38	2287.93	<font color='sienna'><b>Sherley Anne Williams</b></font>	Speaker
2279.381	2287.93	<font color='sienna'>I think contemporary gospel is really one of the most exciting forms, it&#39;s, it&#39;s the most exciting for me, as far as I&#39;m concerned, in and of itself, and that is, in fact,</font>	Transcription
2287.931	2288.95	<font color='sienna'>religious poetry.</font>	Transcription
2290.86	2298.72	<font color='darkcyan'><b>Eleanor W. Traylor</b></font>	Speaker
2290.861	2298.72	<font color='darkcyan'>There is also a tradition that I there is also a tradition.</font>	Transcription
2305.65	2309.19	<font color='#008080'><b>Alvin Aubert</b></font>	Speaker
2305.651	2309.19	<font color='#008080'>Contemporary gospel has absolutely I like traditional gospel,</font>	Transcription
2309.82	2321.61	<font color='darkcyan'><b>Eleanor W. Traylor</b></font>	Speaker
2309.821	2321.61	<font color='darkcyan'>I just want to say one thing, if they will let me. There is a tradition in the literature, that is a commemorative tradition, that people do not speak about. Highly ceremonial.</font>	Transcription
2322.391	2348.61	<font color='darkcyan'>I&#39;ve read some of it, you&#39;ve heard some of it, you know, and it derives from a place which is not a sorghum, flowing, syrupy kind of religious, you know, or a hip shaking, secular place, kind of</font>	Transcription
2348.731	2368.38	<font color='darkcyan'>balanced, integrated vision of life, it takes both into account is a poetry which speaks of the daily round of living that is the blues ain&#39;t it. I woke up this morning. blues all around my head and</font>	Transcription
2368.381	2399.73	<font color='darkcyan'>so on. And then there is that voice that says, I, my mouth, is the mouth of calamity, which has no mouth. I speak and joy burst in the new sun. Nothing sentimental. You know about any of that. You</font>	Transcription
2399.731	2421.69	<font color='darkcyan'>know all lean, no fat. It is not drippy, it is not propaganda, it is not hype or slander. It comes from a sort of clear and head-on head-on observance, you know of the modes of living. And I tried to</font>	Transcription
2421.691	2436.66	<font color='darkcyan'>give voice to some of that which is which expresses that. I think that Sterling Brown poem is incredible. Raising that vision of salvation and ain&#39;t got nothing to do with denominational you know,</font>	Transcription
2436.961	2459.82	<font color='darkcyan'>religion, fundamentalism, you know, the, the convinced, self appointed, right, that will curtail the joy of anybody&#39;s life, but its own hidden. Nothing to do with that. About an old man, dreaming of</font>	Transcription
2459.821	2480.49	<font color='darkcyan'>planting his spring garden. Butter beans, flowers, sugar corn for grace. And for the little fella run in space as a whole vision of life. I never want to be without it. Never want to be with that</font>	Transcription
2480.491	2498.52	<font color='darkcyan'>sound. I want poetry where I can. It allows me to crawl into that space. I want somebody dreaming about planting something for me to eat. And for my children to have a place where they can enact their</font>	Transcription
2498.521	2519.49	<font color='darkcyan'>childhood still not raped of their innocence. So it&#39;s that realm. So such a good deal of that. You know, which ever. I don&#39;t think it sounded much. I don&#39;t think the point really sounded.</font>	Transcription
2522.04	2524.86	<font color='#008080'><b>Alvin Aubert</b></font>	Speaker
2522.041	2524.86	<font color='#008080'>We have one more question over here. I think we can take.</font>	Transcription
2525.4	2526.36	<font color='sienna'><b>Sherley Anne Williams</b></font>	Speaker
2525.401	2526.36	<font color='sienna'>actually she&#39;s going</font>	Transcription
2526.36	2531.16	<font color='#008080'><b>Alvin Aubert</b></font>	Speaker
2526.361	2531.16	<font color='#008080'>Yeah, you were first. Yeah. Okay. We&#39;ll have to two more questions.</font>	Transcription
2531.49	2531.82	<font color='NONE'><b>Unknown Speaker</b></font>	Speaker
2531.491	2531.82	<font color='NONE'>Three.</font>	Transcription
2532.87	2533.8	<font color='#008080'><b>Alvin Aubert</b></font>	Speaker
2532.871	2533.8	<font color='#008080'>Okay, three more.</font>	Transcription
2536.29	2554.14	<font color='NONE'><b>Unknown Speaker</b></font>	Speaker
2536.291	2554.14	<font color='NONE'>Oh, my question segues into your your topic here. I was very interested in the panel commenting on the profound to me profound question that was raised in, in Dr. Alexander&#39;s talk,</font>	Transcription
2555.371	2577.06	<font color='NONE'>which seems to me to go to the the definition of what will be the future of African American poetry in her mentioning in the the poetry of Kevin Young and Carl Phillips. In effect, how much of the</font>	Transcription
2577.061	2593.26	<font color='NONE'>African American tradition should be jettisoned, or what is relevant? I&#39;d like very much to have the panel discuss this issue about, in effect, a definition that young poets are dealing with of what</font>	Transcription
2593.261	2597.34	<font color='NONE'>is in effect, what is African American poetry? And what will it be in the future?</font>	Transcription
2599.47	2604.3	<font color='#008080'><b>Alvin Aubert</b></font>	Speaker
2599.471	2604.3	<font color='#008080'>Elizabeth used the term dyspepsia was that would that relate to what he is saying?</font>	Transcription
2604.75	2617.35	<font color='indigo'><b>Elizabeth Alexander</b></font>	Speaker
2604.751	2617.35	<font color='indigo'>Well, that was just to describe a little kind of dissatisfaction or an attitude or a looking for space uncomfortably, by some of the...</font>	Transcription
2618.64	2635.95	<font color='#008080'><b>Alvin Aubert</b></font>	Speaker
2618.641	2635.95	<font color='#008080'>There seems to be a race weariness. We&#39;ve become so weary of being black in America that I detect this among a lot of young people who want to shove it aside and seek other other means</font>	Transcription
2635.951	2656.32	<font color='#008080'>of, if you want to use the term, redemption. Other than the other than encounters with our history, in the facts of what of our lives in the current continuity of the agony of our lives. They want to</font>	Transcription
2656.321	2671.2	<font color='#008080'>take a shortcut. They want to take a shortcut and one of the shortcuts I see is fundamentalism, religious fundamentalism. They figure I&#39;m tired of things the world I&#39;m going to save my soul. I&#39;m going</font>	Transcription
2671.621	2680.95	<font color='#008080'>to heaven. And I thought maybe that would have been a term dyspepsia also.</font>	Transcription
2684.55	2698.02	<font color='indigo'><b>Elizabeth Alexander</b></font>	Speaker
