1.05	9.84	<font color='sienna'><b>Sherley Anne Williams</b></font>	Speaker
1.051	9.84	<font color='sienna'>In the recent anthology from Harper Collins press, so if you&#39;re interested in a character you can find out a little bit more about it.</font>	Transcription
9.001	25.92	<font color='sienna'>About her rather. Witnessing the vernacular project Alma said into the microphone, &#39;The Black Back-ups,&#39; by Kate Rushin. She stepped around the table, a stack of photocopies held lightly in her arm</font>	Transcription
25.921	38.7	<font color='sienna'>and smiling now, she divided the pile among several people sitting in the first row of chairs in the small lecture hall, indicating that each should take a copy and pass the rest on. Had project</font>	Transcription
38.731	51.18	<font color='sienna'>sounded a little pretentious, she wondered. She had rejected aspects of the vernacular as conventional beyond bearing. &#39;Two white boy,&#39; Thelma had called it and vernacular element elements that</font>	Transcription
51.181	63.18	<font color='sienna'>sounded well, too elementary, especially before this audience of literary scholars. There had been no cries of outrage when she announced her title of course, Alma had the grace to laugh at herself,</font>	Transcription
63.511	74.46	<font color='sienna'>but she observed silently there had been no other reactions either. She resumed her seat behind the table with the other panelists, folded her hands a topic and looked out at the audience saying</font>	Transcription
74.461	86.91	<font color='sienna'>nothing. It wasn&#39;t unheard of for historians to talk about poetry and culture. Though Alma admitted they usually did so uninvited by literary scholars, who seemed at this blush anyway, to be less</font>	Transcription
86.911	100.44	<font color='sienna'>territorial than historians, which Alma was and apparently better known than she thought, or philosophers for that matter. Still, the invitation to talk about the vernacular, common everyday speech</font>	Transcription
100.591	113.43	<font color='sienna'>and Afro-American culture at a national conference on Afro-American poetry had come as a surprise to her. She was a Victorianist by training and Afro-Americanist almost by default. Of course, much of</font>	Transcription
113.431	126.27	<font color='sienna'>her work on the Diaspora was drawn from unwritten sources, oral tellings of a so-called vernacular source, her lips twisted wryly, vernacular was from the Latin word <i>vernaculus</i>, meaning</font>	Transcription
126.451	138.78	<font color='sienna'>&#39;domestic&#39; according to Web Webster, its root word, <i>verna</i> meant &#39;home-born slave&#39;. The African sources of her work were not from slaves, their language was not common or every-day, though it</font>	Transcription
138.781	150.84	<font color='sienna'>was spoken and in some cases never written down until she transcribed it. Only wealthy Africans or those otherwise renowned were named in the accounts passed on by word-of-mouth and retold and sung in</font>	Transcription
150.871	162.0	<font color='sienna'>each generation. Oral culture would always come out on the short end of the stick when pitted against written records, Alma thought glumly. It was only a poem because it was written. If it didn&#39;t work</font>	Transcription
162.001	174.15	<font color='sienna'>on the page, it didn&#39;t work at all, if it could not be recorded, it didn&#39;t exist beyond the moment. The only thing Alma thought again, that had saved negros from extinction was radio and records,</font>	Transcription
174.481	185.16	<font color='sienna'>which would also be the instrument of our destruction, for hadn&#39;t records especially laid bare the very heart of the culture for every enterprising white boy in the world to bleed. &#39;Negro&#39; was the</font>	Transcription
185.161	197.82	<font color='sienna'>common everyday speech of America, and any poetry that called itself African American couldn&#39;t help but be steeped in it. Vernacular in that old sense, was an apt description of New World Africans,</font>	Transcription
198.121	210.99	<font color='sienna'>those Afro-Brazilians and Afro-Cubans, Afro Americans descended from the kidnapped and enslaved <i>verna</i>, home-born slave. And thus the continuing binary between slave and master seemed to make</font>	Transcription
211.021	222.75	<font color='sienna'>little difference that they were also descended from the slave owners too as well as the slave by culture, if not by actual blood. Her history, the very intellectual tradition in which she labored</font>	Transcription
222.961	235.59	<font color='sienna'>always came back to slavery. And historian though she was, Alma was tired of slavery. Took too much time in the conversation to review the century-old horrors but one could not assume that everyone</font>	Transcription
235.591	248.49	<font color='sienna'>knew them or understood that slavery affected people&#39;s lives long after its abolition. Thank goodness this audience would know all that. Still, no one in it had yet spoken. Alma looked down at the</font>	Transcription
248.491	261.87	<font color='sienna'>paper before her. Kate Rushin, &#39;The Black Back-ups.&#39; This is dedicated to Mary Clayton, Cissy Houston and was caught as she had been on first reading by Clayton&#39;s name hearing that powerful alto</font>	Transcription
261.871	280.44	<font color='sienna'>bellowing got a case of the steam ro-o-o-o-ola. The word drawn out in the voice fading to silence. Tap, tap, a cowbell beaten by a drumstick. Three, four alone off-mic male voice blues. Alma tore her</font>	Transcription
280.441	292.08	<font color='sienna'>eyes away lest she be drawn completely into the world of the poem. Neither project nor element seemed an adequate description of the wild invention and fusion that seemed renewed and expanded in each</font>	Transcription
292.081	306.45	<font color='sienna'>reading of the poem. No, Alma told herself now. Project was both mask on image and buzzword and she could not but be pleased with her title. If she let it, the names in the poem would draw her on as</font>	Transcription
306.451	318.78	<font color='sienna'>they must now be drawing the audience past the dedication into narrative plaints so widely voiced it was now almost formula. Bump up against old ironies cast in a new light, half forgotten memories</font>	Transcription
318.781	331.05	<font color='sienna'>reveal now as rites of passage phrases playfully turned and twisted. The reader made into part of the chorus. Not the doo-wop girls, the white boys rave about but the girls who sang back-up on there</font>	Transcription
331.051	343.86	<font color='sienna'>is something on your mind the parody, doo doo doo doo doo, doo doo doo doo doo. Yes, Alma told herself. Even nodded a little. There would be plenty of discussion when they finished reading. Smile,</font>	Transcription
343.891	345.87	<font color='sienna'>smiling slightly, she leaned forward.</font>	Transcription
347.311	357.06	<font color='sienna'>Thelma had actually thought she was doing Alma a favor when she&#39;d suggested Alma&#39;s name for this panel. Thelma wrote about the broad range of black woman&#39;s literature, though in recent years, she had</font>	Transcription
357.061	367.23	<font color='sienna'>focused her attention on the rich turn-of-the-century period, and the first literary outpourings of the free people. Alma had some interest in the period, had met Thelma at a couple of conferences and</font>	Transcription
367.231	379.92	<font color='sienna'>been drawn by the sharp womanist analysis the sister brought to every discussion. Alma had temporized about the invitation. She read some poetry, of course and fiction, but to talk about either one to</font>	Transcription
379.921	391.77	<font color='sienna'>an audience of people who talked and wrote about them for a living, held no appeal to her. She would check her schedule, she told the voice on the phone, get back to them. She called Thelma. Just talk</font>	Transcription
391.771	404.19	<font color='sienna'>about what you know, Thelma said non-literary sources of cultural documentation and occupa- and academic scholarship sounded dull as dust at a poetry conference, Alma objected. Then just do a</font>	Transcription
404.191	415.74	<font color='sienna'>conventional history. After all, history is your thing, outlining uses of the vernacular and literary poetry, a development with which Alma was at least somewhat familiar, identifying vernacular</font>	Transcription
415.741	428.46	<font color='sienna'>idioms and literate sources was a way of documenting traditionalist sentiment otherwise unrecorded among pre-literate peoples, And Alma had began her research with Lucy Terry Prince. Eunice Allen see</font>	Transcription
428.461	440.7	<font color='sienna'>the Indians coming and hope to save herself by running and had not her petticoat stopped her. The awful creatures have not caught her and Tommy hocked her on the ground for dead. Alma&#39;s lips quirked</font>	Transcription
440.701	452.31	<font color='sienna'>at the grim humour of the remembered lines, but it taken a graduate student to make her see that humor in the rough rhythms of Terry&#39;s lines. Her notes highlighted Paul Laurence Dunbar&#39;s contributions</font>	Transcription
452.491	465.93	<font color='sienna'>in removing as his contemporary James Weldon Johnson had said much of the course negro-ness from the so-called nigra dialect coined by whites at the turn of the century. And she contrasted him with</font>	Transcription
465.931	483.42	<font color='sienna'>his contemporary, James Weldon Johnson, who had taken the process even further. Preparing a field for the authentic dictions of Langston Hughes and Sterling Brown and so on and so forth. Even now,</font>	Transcription
483.451	495.42	<font color='sienna'>Alma was a little saddened by the musical about Paul Laurence Dunbar and James Weldon Johnson&#39;s the time that each of these had spent on Broadway that had never been written, would probably never be,</font>	Transcription
495.421	509.04	<font color='sienna'>at least in her lifetime written, nor would the tragedy of split literary persona of their split of the split literary persona, that neither they nor their lineal descendant Sterling Brown had ever</font>	Transcription
509.041	521.31	<font color='sienna'>overcome. One voice to speak for the people, the folk who can&#39;t make the book talk for themselves. Another standard voice to speak for the low college educated me. She would never see a performance of</font>	Transcription
521.341	532.86	<font color='sienna'>asking mama or the animated feature that should have been made from montage on a dream deferred. Alma lamented and play the blues while she read, took notes, wrote, but convention hadn&#39;t worked. Not</font>	Transcription
532.861	545.01	<font color='sienna'>even when she fell back on style. The kind of anecdotal irreverent chitchat she and Thelma often shared about the period. Papers rustled in the audience. A chair scraped. Alma looked out at out at the</font>	Transcription
545.011	557.1	<font color='sienna'>people. Maybe that was what they came for convention, what she should have given them. But she hadn&#39;t found the words for even that. You could talk about violence&#39;s vernacular Pearl had said when Alma</font>	Transcription
557.101	568.8	<font color='sienna'>consulted her Pearl was a writer, novelist, little known and journalist. She actually earned a close but stable living from the reams of opinions, interviews, features and ghosted speeches that</font>	Transcription
568.801	582.75	<font color='sienna'>streamed from her printer. Pearl made Alma listen to Baraka&#39;s poem from my father-in-law, but just the mention of Amiri Baraka&#39;s name, aka Leroy Jones, made Alma uneasy. Baraka was part of the madness</font>	Transcription
582.751	594.78	<font color='sienna'>of the 70s coined traditions and a violent and vicious chauvinism. She said none of this allowed, of course, time was too short to be getting into an argument with Pearl. Besides, and this she had</font>	Transcription
594.781	606.99	<font color='sienna'>said aloud, Leroy did his best work in the post-Beat period, the late 50s and early 60s. It&#39;s the politics, isn&#39;t it, his radical Marxism. Pearl had taunted and shoved a book open to the Crow Jane</font>	Transcription
606.991	620.67	<font color='sienna'>series under Alma&#39;s nose. Stung, Alma retorted more like sexual gluttony and narcissism. Pearl had backed off then or talk about jazz as both vernacular and haute couture. She&#39;d offered in compromise,</font>	Transcription
620.821	634.02	<font color='sienna'>and referred Alma to Michael Harper and Yusef Komunyakaa. But Alma found a way to say what interested her about their poems, let alone what might interest a roomful of literary critics. Alma tuned</font>	Transcription
634.021	635.13	<font color='sienna'>into spoken word.</font>	Transcription
637.611	651.71	<font color='sienna'>And saw even the and saw how even the best especially the best of these poets were seduced into stand-up or sing silently for whatever reason, on sight. She tried to listen to rap, but it made her</font>	Transcription
651.711	664.1	<font color='sienna'>feel too white. Hip hop was no substitute for song. What little she understood of the lyrics of hardcore, offended and repelled her. She refused to return to the blues as a matter of principle. She</font>	Transcription
664.101	675.17	<font color='sienna'>had never gone with a man who wore hydrate pants, nor worked in a house of the rising sun. And while she often admired this one&#39;s technique, or that one&#39;s artistry, she didn&#39;t believe that anyone who</font>	Transcription
675.171	686.99	<font color='sienna'>now saying of having done so, had ever, ever had either, no matter how well they reproduced blues form. Rap was the only form to evolve from contemporary circumstances. But the circumstances of which</font>	Transcription
686.991	700.07	<font color='sienna'>they spoke were not hers. She watched videos and went to galleries and clubs, deciding that what we mean when we said vernacular, was really what we mean when we said Black. The truth was that all of</font>	Transcription
700.191	711.68	<font color='sienna'>it--spoken word, hardcore, hip hop, performance, installation, whatever--spoke to her but did not move her to speak, or at least to write the little occasional paper she had expected to produce.</font>	Transcription
713.271	727.25	<font color='sienna'>Horace sent her a copy of the jazz poetry anthology, and she had seen in its title a fusion of low, that is, vernacular of slaves, for jazz was certainly that and high culture, and the so-called high</font>	Transcription
727.251	739.52	<font color='sienna'>culture in less than a century in American life. She found in Rushin&#39;s poem the need for a word other than vernacular to describe the fusion, she read there. Freedom came out of crossbreeding between</font>	Transcription
739.521	751.4	<font color='sienna'>master and slave, a kind of freedom at least, if the scatting meant anything in the poem, she thought, and she couldn&#39;t be sure of that until she heard the poem performed, it invited you to see that</font>	Transcription
751.461	764.57	<font color='sienna'>classless, castless and egalitarian society freedom or did it just mean that these were so much false hope. Beside her, the previous speaker coughed nervously into his cupped hand. Alma turned an</font>	Transcription
764.571	777.68	<font color='sienna'>inquiring face to the panel moderator who was staring at her. She turned back to the audience and waited. Is that it? An incredulous make voice called from the back of the room. Sir, did you read the</font>	Transcription
777.681	790.85	<font color='sienna'>poem? she asked politely. There was some muffled laughter papers rustled softly and still as people began to read the two pages she&#39;d handed out and Alma looked at the narrator expectantly. He nodded</font>	Transcription
790.851	806.15	<font color='sienna'>and smiled encouragingly. She leaned forward into her microphone, The End. The moderator stared at her again, Well, you can at least read the poem. He seems she noted rather peeved, which rather</font>	Transcription
806.151	821.06	<font color='sienna'>peeved her as her&#39;s was the only presentation that seemed likely to stay within the strict time limits that every that every other panelists had casually flounted. Once again, Alma stood behind the</font>	Transcription
821.151	836.33	<font color='sienna'>microphone. The black back-ups, she announced for Mary Clayton, Cissy Houston, Vanetta Washington, Dawn, Carita McClellan, Rosie Farmer, Marsha Jenkins, and Carolyn Williams. This is for all the black</font>	Transcription
836.331	851.54	<font color='sienna'>women who&#39;s sang back-up for Elvis Presley, John Denver, James Taylor, Lou Reed, etc, etc, etc. I said Hey, baby, take a walk on the wild side. I said, Hey, baby, take a walk on the wild side. And the</font>	Transcription
851.541	854.96	<font color='sienna'>colors colored girls say doo doo doo doo doo</font>	Transcription
854.001	871.49	<font color='sienna'>doo doo doo doo doo doo doo doo doo. This is for my great grandmother Esther, my great grandmother Addie, my grandmother called sister my great aunt Rachel. My aunt Hilda my aunt Thyme, my aunt Britt</font>	Transcription
871.521	884.99	<font color='sienna'>Breda. My aunt Gladys, my aunt Helen, my aunt Ellie, my cousin Barbara, my cousin Doty, and my great-great aunt Vin. This is dedicated to all the black women riding on buses and subways back and forth</font>	Transcription
884.991	897.5	<font color='sienna'>to the mainline Haddonfield, New Jersey Cherry Hill and Chevy Chase. This is for those women who spent the summers in Rockport, Newport, Cape Cod in Camden, Maine. This is for the women who opened</font>	Transcription
897.501	914.63	<font color='sienna'>bundles of dirty laundry sent home from ivy-covered campuses and the colored girl say, doo doo doo doo doo, doo doo doo doo. Jane Fox, Jane Fox, calling Jane Fox Where are you, Jane? my great aunt</font>	Transcription
914.631	927.23	<font color='sienna'>Rachel worked for the Foxes ever since I can remember. There was the boy whose name I never knew. And there was the girl whose name was Jane. My aunt Rachel brought Jane&#39;s dresses for me to wear.</font>	Transcription
927.441	938.06	<font color='sienna'>Perfectly good clothes, and I should have been glad to get them. Perfectly good clothes, no matter they didn&#39;t fit quite right. Perfectly good clothes, Jane brought home in brown paper bags with an</font>	Transcription
938.091	950.03	<font color='sienna'>air of accomplishment and excitement. Perfectly good clothes, which I hated. It&#39;s not that I have anything personal against you, Jane. It&#39;s just that I felt guilty for hating those clothes. I mean,</font>	Transcription
950.211	965.84	<font color='sienna'>can you get to the irony of it Jane? And the colored girls say doo doo doo doo doo doo doo doo doo. At school in Ohio, I swear to God, there was always somebody telling me that the only person in</font>	Transcription
965.841	978.74	<font color='sienna'>their whole house listened and understood them, despite the money and the lessons, was the housekeeper. And I knew it was true. But was What was I supposed to say? I know it&#39;s true. I watched them</font>	Transcription
978.741	988.55	<font color='sienna'>getting off the train and moving slowly toward the country squire with their uniform in their shopping bag. And the closer they get to the car the more the two little kids jump and laugh and even the</font>	Transcription
988.551	1001.18	<font color='sienna'>dog is about to turn inside out because they just can&#39;t wait until she gets there. Edna. Edna. Wonderful Edna, but aunt Edna to me or Gram or Miss Johnson or Sister Johnson on Sundays, and the colored</font>	Transcription
1001.181	1018.19	<font color='sienna'>girls say doo doo doo doo doo. This is for Hattie McDaniels, Butterfly McQueen, Ethel Waters, Sapphires, Sephronia, Ruby Begonia, Aunt Jemima Aunt Jemima on the pancake box, Aunt Jemima on the pancake</font>	Transcription
1018.191	1032.08	<font color='sienna'>box, Aunt Jemima on the pancake box, Aunt Jemima in the pancake box. Ain&#39;t your mama on the pancake box? Mama mama get off of that damn box and come home to me. And my mama leaves off of that box and</font>	Transcription
1032.081	1043.09	<font color='sienna'>she swoops down in her nurses cape what she wears on Sundays, and on Wednesday night prayer meetings and she wipes my forehead and she fans my face for me and she makes me a cup of tea and they don&#39;t</font>	Transcription
1043.091	1060.19	<font color='sienna'>do a thing for my real pain except she is my mama, mama, mommy, mommy, mammy, mammy, mam-my, mam-my, I&#39;d walk a mile, a million miles for one of your smiles. This is for the black back-ups. This is</font>	Transcription
1060.191	1078.28	<font color='sienna'>for my mama and your mama, my grandma and your grandma. This is for the 1000 1000 1000 black back-ups. And the colored girls say doo doo doo doo doo doo doo doo doo doo doo.</font>	Transcription
1103.02	1115.92	<font color='#008080'><b>Alvin Aubert</b></font>	Speaker
1103.021	1115.92	<font color='#008080'>is of course a prime example of how you can use the vernacular and talk about the vernacular and demonstrate the vernacular, and some other things too, all at the same time. It&#39;s a</font>	Transcription
1115.921	1128.07	<font color='#008080'>wonderful piece. Yeah, for those maybe I should not say this, but I want to say it anyway. But for those of you who may be concerned about the gender makeup of the panel, there were two men other than</font>	Transcription
1128.071	1144.12	<font color='#008080'>myself, supposed to be here. One of them bowed out early enough. And one has not shown and I don&#39;t know why. What I did  talk to Sterling Brown. He did have some reservations about flying US Air, and</font>	Transcription
1145.651	1158.79	<font color='#008080'>said that he might even drive from Chicago here. So maybe he&#39;s tangled up in the mountain somewhere as we got tangled up in marble mountains once. But my, we and my wife and I flew US Air and when we</font>	Transcription
1158.791	1168.33	<font color='#008080'>were coming into Pittsburgh, I told her don&#39;t look out the window, you might see something you don&#39;t want to see. And we got here safely and we have to go back to US Air. So but we were on a DC-9 a</font>	Transcription
1168.331	1181.35	<font color='#008080'>different plane. We have some time left over for questions, discussion, whatever. So I&#39;m going to open open the house up now to that and I hope you have some questions.</font>	Transcription
1184.64	1189.11	<font color='#008080'><b>Joanne V. Gabbin</b></font>	Speaker
1184.641	1189.11	<font color='#008080'>You can just come down introduce yourself and speak into the microphone. Great.</font>	Transcription
1189.89	1204.41	<font color='brown'><b>Darrell Stover</b></font>	Speaker
1189.891	1204.41	<font color='brown'>My name is Darrell Stover an author from DC, direct a performance poetry group called the spoken word, six years old. I first want to thank Elizabeth for voicing the whole aspect of</font>	Transcription
1204.411	1223.4	<font color='brown'>performance coming out of the gay community, specifically DC zone Essex MPO[?]. My question regards specifically, if we&#39;re going to look at the matrix, and indeed, lift the poems off the page and let</font>	Transcription
1223.401	1238.55	<font color='brown'>them speak, there is that aspect of performance whereby poetry is accompanied by music. I speak to the fact of what Amiri Baraka does. Jane Cortez, and others, I also speak to the rappers who sample.</font>	Transcription
1240.051	1255.2	<font color='brown'>I also speak in regards to Eleanor Traylor, in regards to Larry Neal, I had the opportunity to examine Coltrane poems and perform Larry Neal&#39;s Orishas, just this past Saturday in a lecture. But I was</font>	Transcription
1255.201	1268.64	<font color='brown'>wondering if the panel could address that whole aspect of the matrix in regards to poetry performed with music, be it blues, jazz, gospel, pop, or otherwise?</font>	Transcription
1273.86	1288.53	<font color='indigo'><b>Elizabeth Alexander</b></font>	Speaker
1273.861	1288.53	<font color='indigo'>One? Just a brief thing, which is that, um, some of the poets that you&#39;ve mentioned, the poets that you mentioned up here who work with music, I guess what interests me is poetry</font>	Transcription
1288.531	1301.91	<font color='indigo'>that works on the page, and then the music adds another dimension to it. Um, I&#39;m interested in work that can can do all of that at the same time. I don&#39;t I&#39;m not sure what the question is exactly. But</font>	Transcription
1301.911	1314.03	<font color='indigo'>that would just be my, my comment on the people that you&#39;ve mentioned, in particular, that their work is successful in different ways. In both of those in both of those modes.</font>	Transcription
1317.42	1331.43	<font color='darkcyan'><b>Eleanor W. Traylor</b></font>	Speaker
1317.421	1331.43	<font color='darkcyan'>I think that, that you can gather that I am convinced that that is the original nature of it, of poetry. That it begins that way, I don&#39;t think anybody ever call measured word. I</font>	Transcription
